"job_id","job_title","job_snippet","company_name","company_location","job_salary","company_rating","company_no_reviews"
"88b58936e5b4a3dc","Analist Sanger Sequencing en Microbiologie","Je maakt onderdeel uit van een gemotiveerd team van managers en (senior) analisten en je bent verantwoordelijk voor de dagelijkse praktische uitvoer van…
","BaseClear","Leiden","Voltijds",NA,NA
"f5465d326820df16","Data Engineer","You'll be part of the team responsible for making sure our scalable data systems and pipelines run smoothly, and work to organize and process to allow analysts,…
","Lemonade","Amsterdam",NA,NA,NA
"fb524cad078c0411","Data Analyst","As a data analyst, you will play a major role in our customers’ initiatives in the areas of data integration, data migration data quality and data management.
","Valcon","Postcode 3541 in Utrecht",NA,NA,NA
"709590576b42f71c","nieuwData Engineer_ Customer Analytics","Your tasks comprises bringing models into production including connecting data input into the model and output to web, app or other systems via APIs or other…
","Cubestech","Nederland",NA,NA,NA
"ee91ff519de0acfe","DATA ANALYST","Je werkt nauw samen met email en CRM marketeers, data scientisten en online data analisten.
 Monitoren data pipeline, verzending executies en levering van emails…
","de Bijenkorf","Amsterdam",NA,"3.8","72"
"89d576e486f178c1","Data Analyst","You will be working closely with Mollie’s data team & other departmental data analysts, the finance leaders and their teams to provide real-time insights into…
","Mollie","Amsterdam","Voltijds","4.5","4"
"9137643e1390373d","Logistieke Data Analist Sligro CDC Veghel","(Analytische verbinder tussen vloer en management)).
 Binnen de afdeling besturing van het Centraal Distributiecentrum (CDC) in Veghel, zijn wij op zoek naar een…
","Sligro","Postcode 5466 in Veghel","Voltijds, Contract bepaalde tijd","3.5","120"
"4ac72148db4603d1","nieuwData Quality Analyst","Previous experience as data quality analyst.
 Developing automated data monitoring scripts to discover data issues across the Mendix data landscape.
","Mendix","Rotterdam","Voltijds","4.2","16"
"faf312d38dd2cc41","Data Scientist","5+ years’ experience and relevant track record working in international environments with experience as a data scientist or advanced analyst.
","FrieslandCampina","Amersfoort",NA,"4","388"
"5a73a5875d788155","Market Data Management Analyst","Based on your knowledge and skills of investment and data, you will be validating and enriching the data according to the standards agreed with the consumers of…
","APG","Hybrid remote in Nederland",NA,"3.7","34"
"40b9db2e62039179","Marketing Analyst","Aantoonbare ervaring met big data.
 WO master in econometrics / data analytics / marketing intelligence / data science.
 Als Big data je niet echt kan bekoren.
","wehkamp","Zwolle+1 plaats",NA,"3.3","45"
"893aaa64283807aa","Lead Data Scientist","Leading a team of talented individuals, data scientists, plant scientists, and software engineers; and collaborating closely with a product manager and product…
","Source.ag","Postcode 1061 in Amsterdam West","Voltijds",NA,NA
"fc986a85617a9de4","Business Intelligence Analist","Aantoonbare ervaring in het bouwen van data warehouses, ETL processen en data modellering.
 Onderhouden van data warehouses in SQL Server Management Studio;
","Ksyos","Thuiswerken in Amsterdam","€4.000 per maand -  Voltijds, Deeltijds","4.2","17"
"5bbcfb86e51b90dc","Data Research Analyst","Experience working with and analyzing large data sets and in developing actionable intelligence from the data.
 Strong mathematical and statistical background.
","Apeiron Insight","Thuiswerken in Rijswijk","Vaste baan",NA,NA
"793e228318cb3eb7","SEA Specialist/Data Analist","Hiermee zorg jij voor relevante inzichten uit de beschikbare data.
 Je bent analytisch en kunt data vertalen naar marktinzichten en rapportages.
","DBG Nederland","Nijverdal","Voltijds",NA,NA
"8aab59b7056c5ef2","Data Engineer","At least 3 years of experience in data engineering in the big data domain.
 Experience building and optimizing data pipelines, architecture, and data sets.
","Lemonade Insurance Company","Amsterdam","Voltijds",NA,NA
"55b6156f3781bf72","SAP SAC with BPC exp","You are expected to handle data from various data sources and determine how to best structure the data in order to provide data in a ready-to-use form to data…
","Cubestech","Nederland",NA,NA,NA
"46ec9526ccf84b84","Security Analist","Je hebt aantoonbare kennis van- of ervaring met het uitvoeren van pentesten, het inrichten van SIEM-tooling, data analyse en dashboarding;
","Centraal Justitieel Incassobureau (CJIB)","Leeuwarden","Vaste baan, Contract bepaalde tijd",NA,NA
"d8ce60fd4f974a6a","Data Scientist - All Europe","The data scientist is responsible for overseeing the collection, storage and interpretation of data for businesses.
 Build tools to automate data collection.
","Majorel Corporate","Amsterdam",NA,"2.9","394"
"ec26f4de267a278b","nieuwData Analyst - Business Intelligence","Technical and have a good understanding of all components of an analytical data pipeline.
 We are in the lead to curate and build dashboards and data sources…
","Adyen - INTERNAL JOBS","Amsterdam+3 plaatsen","Voltijds",NA,NA
"ebf44233e74e294d","nieuwSoftware developer","Onze applicaties richten zich op het verzamelen (administreren), analyseren en presenteren van de data; en dat op een intuïtieve en gebruiksvriendelijke manier!
","Your Next Concepts","Thuiswerken in Utrecht","Voltijds, Tijdelijk",NA,NA
"d74b60de6f88754f","Senior Data Engineer Business Intelligence","You will work together with data analysts and finance and business stakeholders on further developing and maintaining the Microsoft Analytics platform,…
","Flamco Group","Almere","Vaste baan",NA,NA
"3ba93a3a2e7bc314","Business Analist","De brug vormen tussen de wensen van de klant en het technische product.
 In kaart brengen hoe wij onze producten kunnen verbeteren aan de hand van de wensen van…
","IKUU","Arnhem",NA,NA,NA
"05ee721c21e437ef","Business Analist Publieke sector","Jouw job in één alinea.
 Je werkt in een practice met maar liefst 350 inspirerende collega’s.
 Genoeg mensen om mee te sparren dus.
","Capgemini","Utrecht","Voltijds","3.8","8510"
"1219ddf2fd080c74","Data Analist","Jij levert een actieve bijdrage aan innovatie op het gebied van data, denk hierbij aan predictive analytics, statistische analyses, dashboarding en big data.
","VINCI Energies","Eindhoven",NA,"3.9","999"
"82b044ff82f3756e","data analist HEMA app","Data die vandaag weer wacht op jou als data analist om inzichtelijk gemaakt te worden.
 Ervaring in een vergelijkbare analytische rol met grote hoeveelheden data…
","HEMA","Postcode 1033 in Amsterdam Noord","Voltijds","3.6","795"
"86f52e18141c4a7f","Data Engineer","Exposure to real time data ingestion / streaming data sources.
 Working knowledge of data governance principles (e.g. data profiling, data cataloguing, managing…
","Cloud Technology Solutions","Tijdelijk thuiswerken","Projectbasis",NA,NA
"6d5337563de6688f","Data Analist","Consolideren van online data ter voeding van ons data warehouse (SQL & PowerBI);
 Owner van de data verzameling, datalayer en tools t.b.v. de consolidatie van…
","Hallmark","Capelle aan den IJssel",NA,"3.8","4915"
"77e6b278bc76dfd1","Talent Program Data & Analytics – Cmotions","Dan is Cmotions Talent Program data & analytics misschien wel jouw kick-start.
 Cmotions heeft al meer dan 18 jaar ervaring met het ontwikkelen, plaatsen en…
","Cmotions","Bunnik","Deeltijds",NA,NA
"bc10292163f94179","Data-analist 32 uur","Als onze Data-analist ben je verantwoordelijk voor de analysefase.
 Bovenal haal je vanuit je data-analyses nieuwe kansen en denkrichtingen naar boven.
","Bieze Food Group","Nijkerk",NA,NA,NA
"b3a7359f926f151a","Junior Analist Marketing","Werken in een data snoepwinkel, van gedrag op de website en onze apps, tot marketing data vanuit al de marketing kanalen en de uiteindelijke klant- en…
","Coolblue","Rotterdam+2 plaatsen","Voltijds","3.9","213"
"d74203dbaf1ea38c","Market Data Analyst","By thinking how modern technology can help increase data quality and traceability.
 Knowledge of Bloomberg, Reuters or other data vendor systems is considered a…
","Rabobank","Postcode 3521 in Utrecht","Voltijds","4","1343"
"354027b109c4ef98","Quality Analyst Amsterdam","Conduct root cause data analysis and summary.
 Ability to digest large data sets/policies in a cohesive and actionable manner.
 Bachelor’s degree or above.
","TikTok","Amsterdam+4 plaatsen",NA,NA,NA
"55438484f06367e5","Full Stack Developer","We are on a path to become the single largest provider of commercial intelligence and automation across the travel and transportation industry.
","FLYR","Hybrid remote in Amsterdam+1 plaats","€50.000 - €100.000 per jaar -  Voltijds, Vaste baan",NA,NA
"e7a30a9138cbad02","(Senior) Research Analyst","This involves improving the accuracy of scoring by: looking out for better data collection mechanisms, aligning our approaches with current industry standards,…
","Dayrize","Thuiswerken in Amsterdam","Voltijds",NA,NA
"25000ede3752f382","nieuwMarket Intelligence Analyst","With this role we expect strong data analysis, the ability to translate data into tangible insights, and with an aptitude for strategic thinking and problem…
","FrieslandCampina","Amersfoort",NA,"4","388"
"05e1653f1fd9cc2c","Web Analist","Analyseren van performance data en verzamelen van inzichten voor toekomstige acties;
 Prioriteren van (ad-hoc) data verzoeken en troubleshooting binnen het team;
","Holland & Barrett","Amsterdam",NA,"2.8","767"
"0a23b503f4f16126","DATA ANALIST","Je hebt ervaring met rapportages en data visualisatie.
 Je hebt ervaring op het gebied van data analytics en voorspelmodellen.
","IMPROVEN BV","Utrecht",NA,NA,NA
"e0598cb08f190d5f","nieuwReporting analist","Als Reporting analist maak je deel uit van het operationeel en tactische team binnen Large Corporate & Public (LCP), ben je verantwoordelijk voor het uitvoeren…
","Centralpoint B.V.","Hybrid remote in Postcode 6537 in Nijmegen","Voltijds","3.8","18"
"a77ef439d40333bc","Web Data Analyst","You will report directly to the Head of eCommerce, and work closely with the whole Marketing team as well as peers from other departments, including fellow data…
","Polaroid","Amsterdam","Voltijds","4.4","28"
"58937ba1e1e9aedd","Business Analyst","Create, conduct and coordinate financial, product, market, operational and related data research to support Sonion’s Portfolio Value Optimization, Strategy and…
","Sonion Nederland B.V.","Postcode 2132 in Hoofddorp","Voltijds, Vaste baan",NA,NA
"afd7a1bf2b733465","DATA ANALYST/ENGINEER","With your creativity, you will automate manual processes, optimizing data delivery, re-designing infrastructure for greater scalability where needed; Build and…
","Intellerts","Utrecht",NA,NA,NA
"7af3a191f8d6d09f","Analyst | Distribution Operations | all levels","Picnic plays it cool: a data-driven cold chain for groceries.
 You will be part of the Distribution team working closely together with our Area Managers and…
","Picnic","Amsterdam","Stage","3.3","211"
"a5972059351591ee",".NET Engineer","Configure, create and execute basic applications using the C# language.
 Microsoft database technologies, Database optimization skills.
","Rabobank","Postcode 3521 in Utrecht","Voltijds","4","1343"
"216e9b495f66dbed","Data Analyst","2+ years of experience in data analysis, visualization and reporting.
 Analyze large, complex data sets and turn them into actionable insights.
","Azerion","Postcode 1119 in Schiphol","Stage",NA,NA
"c6d03b7e0e662d01","Data Engineer","Work with our data analysts to create business-friendly views of our data;
 Work closely with domain-specific data engineers to create a unified data…
","Sana Commerce","Rotterdam",NA,"4.7","18"
"abbd18ef5369b66f","Business Analist (m/v)","Voor een innovatieve opdrachtgever in Hattem zoeken wij een ervaren Business Analist (m/v).
 Hier zijn ze specialist in advisering en ondersteuning op het gebied…
","Greenmonkeys","Hattem",NA,NA,NA
"9ceb331115b3c231","Data analist","Ook bij ons doe je als data analist het volgende; Je bezig houden met het verzamelen en controleren van gegevens om deze te verwerken tot informatie.
","YoungCapital","Postcode 2132 in De Hoek, Hoofddorp","Voltijds","3.9","373"
"39bc8c0da481ddb7","Lab Analyst","Support and assist our Research Engineers on experiments.
 Assist in setting-up new experiments.
 Process, analyse and report on the results of the experiments.
","Nostics","Postcode 2613 in Delft","Voltijds",NA,NA
"e7f3d00c7e4c67b3","IT Security Engineer - Netherlands","A proactive nature to make data-driven decisions and participate in complex initiatives from conception to deployment.
 Experience in public cloud environments.
","Incopro","Werk van thuis","Voltijds",NA,NA
"21bfd3f9fba160f1","Market Data Management Analist","Op basis van je investment & data kennis en vaardigheden voer je controles en verrijkingen op de data uit (op basis van de normen afgesproken met de consumenten…
","APG","Hybrid remote in Amsterdam","€4.295 per maand","3.7","34"
"9b626aece962f2d7","Data-analist","Je voert daarvoor een breed scala van werkzaamheden uit op het gebied van data engineering, data analytics en data science.
","Turien & Co","Postcode 1817 in Alkmaar+1 plaats","€4.551 per maand","3.5","2"
"131aca608d8e3c74","AML Analyst - EU","Ability to digest and analyze data and create visual reports.
 As an AML Analyst, you will be responsible for day-to-day operational KYC/AML processes and…
","BitPay","Thuiswerken","Voltijds",NA,NA
"3f19bdf6009c3637","Senior Data Scientist","You will also frequently coordinate with data engineers, machine learning engineers, data analysts and customer journey experts to enable the bringing of models…
","ING","Thuiswerken in Amsterdam","Voltijds, Stage","3.9","1923"
"5230090f11796f4e","nieuwBioinformatics Analyst","The Bioinformatics analyst contributes to scientific analysis of large-scale data sets using a variety of bioinformatics techniques and software applications.
","GenomeScan","Leiden",NA,"4","2"
"37ebd07d8da46d13","Data Analyst","Enable and support the business regarding the development and use of data analysis and reporting by: building reporting-grade data sources in our BI environment…
","TripActions","Amsterdam",NA,NA,NA
"f23f9dd5311afae3","Data Analyst","Our ideal candidate is adept at modeling complex data, uncovering patterns, and delivering data-driven insights.
","Lemonade Insurance Company","Amsterdam","Voltijds",NA,NA
"e15b2957d9643547","Data Analyst","At least 5 years of experience as a data analyst, business analyst, BI analyst, or related role.
 Providing technical expertise in data storage structures, data…
","SwipeGuide","Thuiswerken in Postcode 1066 in Amsterdam",NA,NA,NA
"5772c0be049b6e96","Account Executive (Europe)","Our inside sales team works across Europe, and the U.S. Built out with Business Development Reps, Account Executives, Business Development Managers, and Sales…
","Castor","Tijdelijk thuiswerken","Voltijds",NA,NA
"c3d9cac180e2eef6","nieuwAnalist/Ontwikkelaar team Onderwijspersoneel","Jij vormt de verbindende schakel tussen de data enerzijds en de onderzoekers en beleidsmakers anderzijds.
 Je hebt hbo- of academisch niveau, bij voorkeur in een…
","DUO","Den Haag","Vaste baan","3.8","32"
"1746d4c97f3fa25c","Data-analist / Business Intelligence specialist","Vanuit jouw functie als Data-analist / Business Intelligence Specialist begrijp je als geen ander hoe waardevol data is voor een bedrijf en zoek je continue…
","Boval B.V.","Thuiswerken in Haarlem","Voltijds, Deeltijds, Vaste baan","4.2","5"
"be9a2e102f97c008","Business Analist OV-Data","Vertalen van klantvragen naar data-oplossingen.
 Onderzoeken en ontwikkelen van mogelijkheden om nog meer uit onze data te halen.
","Translink","Amersfoort","Voltijds","3.6","36"
"acb56fb838540312","Cloud Data Analyst","Exposure to data modelling / data science methodologies is a bonus.
 Strong data processing experience and understanding of developing against common database…
","Cloud Technology Solutions","Thuiswerken",NA,NA,NA
"190551cd51f02467","EMEA Network Analyst - Amsterdam","Assume responsibility of reviewing and upholding data integrity for Network population in wider CBI reports.
 Degree level qualification and relevant experience…
","JPMorgan Chase Bank, N.A.","Amsterdam","Voltijds","3.9","8641"
"070ec68780940e60","Data Lead - Online Payments","You will be the one driving the solution, either individually or with the support of the engineering team; those can be data heavy products or simple dashboards…
","Airwallex","Amsterdam","Voltijds",NA,NA
"d8c1873130d6844c","Data Analist","Je hebt minimaal 3 jaar full-time werkervaring als data analist;
 Jij dus op het gebied van data.
 Je gaat graag nieuwe data-uitdagingen aan;
","Makerstreet","Postcode 1076 in Amsterdam Zuid","Voltijds",NA,NA
"a8f6e5ec6081b687","Senior Data Engineer","You will support our software developers, data analysts, and data scientists on data initiatives and will create standardized blueprints to enable them to…
","Mollie","Amsterdam","Voltijds","4.5","4"
"b6427bf55cb65ac9","Junior Kwantitatief Data Analist","NIBC is een ondernemende bank gericht op de meest beslissende financiële momenten van hun klanten.
 Binnen Retail Banking van NIBC is het Portfolio Management…
","Statera Recruitment","Den Haag",NA,NA,NA
"4b0d41671cdefedf","Data Scientist / Machine Learning Engineer","You build data products at the crossroads of data science, machine learning engineering and AI.
 We therefore seek data scientists with an appetite for…
","RTL Nederland","Hilversum","Voltijds",NA,NA
"fc43a092f67db879","nieuwER Country Risk Manager/Regional Lead","Experience with (data) projects is a plus.
 Quantitative skills, experience with coding (Python/R/Matlab/etc.) and data analysis is a plus;
","Rabobank","Postcode 3521 in Utrecht","€3.700 per maand -  Voltijds","4","1343"
"70fe2fd3a5ca9d36","Consultant Data Engineering (en)","After the analysis, the data engineer programs data flows that result in Data Lakes and Data Hubs for Data Discovery and integrated multidimensional data models…
","Bravinci","Postcode 3543 in Utrecht",NA,NA,NA
"537da3885c3f0e70","FX Payment Sales Analyst","Carrying out detailed data analysis and valuation.
 This role will be responsible for delivering a high-quality customer experience for our clients across the…
","StoneX Group Inc.","Nederland",NA,NA,NA
"36c18a3212bdda12","Medior KYC analist – ICS","In de rol van Medior KYC analist ben je verantwoordelijk voor het doen van klantonderzoek voor onze bestaande Commercial klanten in het kader van de Wet ter…
","PLANgroep Financiële Services","Utrecht",NA,NA,NA
"c6a753e1e9260d29","Data Scientist and Analytics","2 – 3 years’ experience as BI engineer / data scientist / data analyst – Must.
 Maintain and improve the data pipeline.
 Open new opportunities out of the data.
","Fornova","Amsterdam",NA,NA,NA
"9cf1f84a2b9d6961","Junior Data Analist","Het verzamelen, optimaliseren en inzichtelijk maken van (bedrijfskundige) data- en informatiestromen;
 Helpen de organisatie bewuster te worden op het sturen op…
","A+ Personeel","Capelle aan den IJssel","€3.000 - €3.500 per maand -  Voltijds, Vaste baan",NA,NA
"9c41e21599accee6","Data analyst","As data analyst you work on data collection, data mining, preprocessing and analysis.
 When working as a data analyst you take the responsibility to improve the…
","Prodrive Technologies","Postcode 5692 in Son",NA,"3.8","19"
"33d4b35db85079d1","Digital Marketing Analyst","Based on that data the teams can make the right decisions.
 You will be an Digital Marketing Analyst in our E-Commerce SUN team and your goal is to deliver…
","Sunweb Group","Thuiswerken","Voltijds",NA,NA
"7ca2a0b114816d84","Business Intelligence Data Analyst - Morocco, France, German...","Maintaining, evaluate and improve dashboard and data models.
 Collaborate with teams to design new BI cloud solutions for multi-regional access to distributed…
","Majorel Corporate","Amsterdam",NA,"2.9","394"
"05e64769292bd15e","Senior Security Analyst","Including but not limited, data ingestion & normalization, compliance metrics and detections on assets.
 Assist in partnering with tools, product and development…
","Infor","Thuiswerken",NA,"3.7","553"
"7ea2c1b43a8e5943","nieuwAnalysts Investment Services Professional","Is experienced in producing intelligence through data analysis;
 Maintains internal/external working relations for data delivery and operational questions;
","BNP Paribas","Amsterdam","Voltijds","3.9","4084"
"3da715b6f6125066","Data Analist","Minimaal 2 jaar werkervaring als data-analist.
 Deze vacature staat open voor junior data-analisten, medior data-analisten en senior data-analisten.
","Smart Connections","Amsterdam",NA,NA,NA
"d51aa9b7198c55dc","Senior Business Analist","Je hebt minimaal drie jaar ervaring en affiniteit met het verwerken en interpreteren van statische asset data.
 Ons net wordt steeds zwaarder belast.
","Stedin","Delft","€4.938 per maand","3.7","15"
"dfa9830de32f5671","Reporting Analist","Werken met alle soorten data binnen Coolblue.
 Eva legt je uit hoe je Reporting Analist bij Coolblue wordt.
 Stakeholder management, want je communiceert en denkt…
","Coolblue","Rotterdam+1 plaats","Stage","3.9","213"
"d8913f781e12abfd","nieuwDATA ENGINEER: Real Time Financial Trading Systems","Working closely with Quantitative Traders and Fundamental Analysts, you will ultimately be responsible for data availability.
 BONUS UP TO 100% of Basic!
","BizTek Recruitment Ltd","Amsterdam","€160.000 per jaar -  Voltijds",NA,NA
"2c5cd0f477971997","nieuwBusiness Analist","Op basis daarvan bepaal je ook welke data er op ieder moment vrij komt die nodig is voor de track en tracing van de producten en de datakoppelingen met het ERP…
","Viscon Group","Thuiswerken in Postcode 3295 in 's-Gravendeel",NA,NA,NA
"b36710f07458d02a","nieuwData Analyst - Recurring & Tokenization","Ensuring data integrity, managing ETLs, performing deep analytics into performance, managing our stakeholders and automating the delivery of insights through…
","Adyen","Amsterdam+4 plaatsen","Voltijds","3.4","5"
"f60f3eb2ebf85b6d","Merchant Support Specialist","It is your role to help merchants with questions ranging from technical issues to their customer’s questions about AfterPay, and everything in between.
","Arvato Finance B.V.","Thuiswerken in Postcode 1101 in Amsterdam-Zuidoost",NA,NA,NA
"19dfa0d08faf4f45","Jr. Pricing & Data Analyst","At least 1 year of experience in an analytical and/or data analysis role.
 You will also be responsible for market analytics, forecasting and other ad hoc…
","Travix International","Thuiswerken in Amsterdam",NA,NA,NA
"088c16c9e1cc363e","Senior Data Engineer","Experience with geospatial data manipulation.
 As Data Engineer you are responsible for building and maintaining data pipelines from numerous relevant data…
","Brainbay","Utrecht","Voltijds",NA,NA
"318399ece0bcbe3a","Data Analist","Als data-analist wordt je ingezet bij een van onze opdrachtgevers, dit kan zijn voor een project van een aantal maanden tot een jaar.
","Veneficus","Rotterdam+1 plaats","€3.250 per maand -  Voltijds, Deeltijds, Vaste baan, Freelance / zzp",NA,NA
"f6026ecfef7b5330","JDE Business Analyst (m/w/d) remote","JDE support for business projects, process changes and changes of master data.
 “We manufacture corrosion-resistant pumps and valves of excellent quality, which…
","IDEX Europe GmbH","Thuiswerken","Voltijds, Deeltijds",NA,NA
"d7eb7f48c217ec97","Data Engineer Internship - Amsterdam 2022","Monitor and troubleshoot operational or data issues in the data pipelines.
 Experience with data mining, data warehouse solutions, and ETL.
","Amzn Dev Ctr (Netherlands) B.V","Amsterdam+3 plaatsen","Voltijds","3.5","79703"
"30eba9d0c058433a","Data Analyst – Tableau","4+ years of experience as data analyst ;
 Statistical knowledge and data modelling is required;
 Doing business and data analysis that support the business ;
","CarNext.com","Amsterdam+1 plaats","Voltijds",NA,NA
"bdcc9e11d905685d","nieuwInsurance Portfolio and Claims Analyst","Utilize data visualization to build interactive, informative reports to help embed data driven decisions across the organization.
","iptiQ","Hoofddorp",NA,NA,NA
"93aa162c5f5ae12b","nieuwBusiness Analist Stock Allocatie","Als senior begeleid en coach je hierbij ook een junior business analyst.
 Bol.com gelooft in zelforganiserende teams, samen successen vieren en data-gedreven…
","Bol.com","Utrecht+14 plaatsen","€3.500 - €5.250 per maand","3.9","47"
"6a8459c78d4c5bf2","Informatie Analist","Daarnaast bereid je de testscenario’s en test data voor, documenteer je de testresultaten en los je de knelpunten op doormiddel van troubleshooting.
","Eurofins Netherlands Environment Testing","Barneveld","Voltijds","3","1575"
"215ae5840c54ee19","nieuwBusiness Analist Industrie","Het optimaliseren van complexe onderhoudsprocessen en bijbehorende data in kaart brengen.
 Het ontwerpen van een optimale klantervaring en customer journey door…
","Capgemini","Utrecht+3 plaatsen","Voltijds","3.8","8510"
"487473b4197e0d10","Medior Business Analist","Imagine leveraging your passion for data in developing Rabobank’s data driven ambitions.
 Supporting all business initiatives with a need for data, both…
","Rabobank","Postcode 3521 in Utrecht","Voltijds","4","1343"
"1121312b872423a5","nieuwQuantitative Analyst","Troubleshoot on data hick-ups.
 In this role you support our team with our data ambitions by improving and creating new reports.
","Cefetra Group","Rotterdam","Voltijds",NA,NA
