"job_id","job_title","job_snippet","company_name","company_location","job_salary","company_rating","company_no_reviews"
"1a16d2b4ec988eae","Senior Data / Business Analyst","Experience with data visualization software (e.g. Tableau) is a plus.
 Ability to collect, analyze and assimilate data from multiple sources using SQL.
","Advidi","Nederland",NA,NA,NA
"f17c1d2d13b584a1","Web Analyst","Creating required reports to provide data insights to the business when requested by using different data analysis techniques (e.g., correlating data from…
","Accell Group","Nederland",NA,NA,NA
"fd0b611e26b23547","Senior Business Analyst","Perform data analysis and suggest improvements to business processes.
 Master’s Degree in data science or econometrics domain.
","wehkamp","Zwolle",NA,"3.3","45"
"0b166c4c18ef2333","Space Environments and Effects Analyst","The section provides functional support to ESA projects and carries out technological research (R&D) on space environments within which ESA missions will…
","RHEA Group","Noordwijk",NA,NA,NA
"1d31e01777b2e463","Data analyst, Intern","Demonstrated ability and interest in data analytics.
 Learn to acquire data from Cloud sources.
 Upgrade a recurring report by automating the data processes.
","Prologis","Amsterdam","Voltijds","3.9","101"
"9222583fa76d2622","Business Analyst","Front End Analytics: data visualisation, data storytelling and mobile app development.
 Business processes: data modelling and business analysis.
","Valcon","Postcode 3541 in Utrecht",NA,NA,NA
"d36d1d2aba8f6229","Business analist Inkoop, Logistiek en Financiën","Als Business analist bij het Martini Ziekenbuis ben je gericht op resultaat.
 Je verzamelt en analyseert daarvoor relevante data en vertaalt deze actief naar…
","Martini Ziekenhuis","Groningen","€3.389 - €4.964 per maand -  Contract bepaalde tijd","4.3","13"
"a10093d1d56429df","Data Scientist (14761) - North America (Remote)","Partnering with product, data scientists, data analysts, and data engineers, you will help define success and our test and learn strategy both in the realm of…
","Getty Images","Tijdelijk thuiswerken in America","Voltijds",NA,NA
"5c4d91f0fc68f67c","Junior Azure Developer","The Enterprise Data Lake consists of several teams.
 As a Junior Azure Developer you will work in one of two scrums team focusing on the automation of Enterprise…
","Rabobank","Postcode 3521 in Utrecht","€3.100 - €3.300 per maand -  Voltijds","4","1343"
"4aa21b7c5037cb2d","Business Analyst, Netherlands","Undertaking regular data analysis across the commercial databases and reinforcing a data-driven approach to decision making across the organization.
","Alexion Pharmaceuticals,Inc.","Den Haag",NA,NA,NA
"28d432b12364f317","Sponsorship Sales Executive","Work with the data analyst to develop and implement tools that enable us to provide data driven solutions to our clients.
","ELEVEN (Amsterdam)","Postcode 1033 in Amsterdam Noord","Voltijds",NA,NA
"aed277c323002b60","Physics Analyst","Analysis of the experimental data.
 Experience with analysis of experimental data and understanding of related challenges.
 PhD in Physics or equivalent.
","SiTime Corporation","Postcode 2612 in Delft",NA,NA,NA
"a434de74fecec7ce","nieuwMarketing Insights Analyst","Je hebt veel affiniteit met data en bent cijfermatig en analytisch sterk ontwikkeld.
 Ontsluiten van de juiste data uit interne en externe bronnen en deze – door…
","RTL Nederland","Hilversum","Voltijds",NA,NA
"2246c17d8d82000a","Business Analist","Als business analist ben je een drijvende kracht voor de coöperatie.
 Een ideale stap wanneer je met aantal jaren werkervaring als (proces) consultant een stap…
","AVIA Netherlands","Nederland",NA,NA,NA
"fa4c620ff7418ad9","nieuwData science software engineer","Een data profiling check kunnen doen;
 Je bent gewend om te schakelen met data scientists.
 Verwachtingswaarden kunnen berekenen middels data science technieken…
","De Staffing Groep","Arnhem",NA,"3.5","2"
"f2b097fc09489fb6","Head of Data Science & Analytics","Recruit, manage and lead a team of world-class data analysts and data scientists to support our aggressive growth and deliver key data products and capabilities…
","Creative Fabrica","Amsterdam",NA,"3.2","6"
"600e0a673fff3e93","Renewable Data Analyst (Power)","Be comfortable with big, complex data sets, analysis, and application of that data to drive business value.
 Highly analytical, data driven with strong attention…
","Shell","Den Haag","Voltijds",NA,NA
"cffd2b3ce9043c2e","Backend Developer - Remote (Europe) - 12 month Contract","Build analyst-facing solutions interacting with different data sources to support service deliverables.
 Increase actionability of threat intelligence reporting…
","Mandiant","Thuiswerken in Amsterdam","Voltijds",NA,NA
"287edf0e67062fb1","Business Analyst Client Data Quality","Analyze data and data quality issues to find the root causes.
 Broad experience in data management and/or data quality management.
","Rabobank","Postcode 3521 in Utrecht+5 plaatsen","Voltijds","4","1343"
"d5f056bdd9e27ead","ESG Research Analyst, Index Intelligence","Contribute to the designing of quality assurance processes for ESG datasets, data change reporting, annual data vendor reviews.
","S&P Global","Postcode 1077 in Amsterdam Zuid",NA,NA,NA
"5c311b8c2faf89e8","Junior Airport Security Consultant","With your experience and knowledge of security processes and systems in and around airports (or similar environments) you add value to our projects and liaise…
","Royal HaskoningDHV","Thuiswerken in Den Haag",NA,"4","75"
"68c3dde5560e344f","Informatie analist","De Consumentenbond test jaarlijks duizenden producten en diensten.
 Je doet analysewerkzaamheden op basis van aanvragen vanuit de business.
","Consumentenbond","Postcode 2521 in Den Haag+2 plaatsen","€3.220 - €5.294 per maand -  Voltijds","4.3","4"
"cc039ce051bc3d30","Informatie Analist","Op deze manier vergroten zij de data gedreven sturing van de organisatie.
 Deze onderzoeksvragen resulteren in een set van benodigde data-entiteiten, attributen…
","Nippur","Oirschot","€3.500 - €5.500 per maand -  Voltijds, Vaste baan",NA,NA
"2518d8e1389c5e9d","nieuwBusiness Analyst","You are analytical and driven by data rather than gut feeling.
 Therefore, you need to be a state-of-the-art business refiner, preferably with experience in a…
","ING","Amsterdam+2 plaatsen",NA,"3.9","1923"
"b0779c7315d6d63e","Informatie-analist & integratie-specialist","Energie Data Services Nederland (EDSN) werkt samen met alle regionale netbeheerders, TenneT en Gasunie Transport Services (GTS) aan de centrale…
","Energie Data Services Nederland","Utrecht","Deeltijds","3.8","12"
"afe29b775da30b21","IT Business Traineeship","Een mooi startsalaris van €2750, een reiskostenvergoeding en 26 vakantiedagen;
 Je komt regelmatig samen met mede trainees om ervaringen uit te wisselen en van…
","Qompas","Randstad","€2.750 per maand -  Voltijds",NA,NA
"ee929d60cae4a567","Business Analist","Wij zijn op zoek naar een ervaren Business Analist die kan bijdragen aan het verbeteren van onze organisatieprocessen.
","Handelsbanken","Amsterdam-Zuidoost",NA,NA,NA
"5f38995520865adf","Junior Strategy & Business Analyst","Able to analyse and draw meaningful conclusions from data.
 Corporate strategy and management support.
 Versatile work environment (sales, production, product…
","Ubbink","Thuiswerken in Postcode 6984 in Doesburg","Stage","3.5","6"
"44bf514db1fa8569","Senior Data Analyst","3+ years of experience manipulating large data sets, building statistical models, and generating actionable insights from these data & analyses.
","Domino's Pizza Netherlands","Postcode 3433 in Nieuwegein","Voltijds","3.5","29419"
"3b1dc0ac639e3390","nieuwSenior BI-analist","Maximaliseer data-gedreven werken en realiseer daarmee onze digitale ambitie als senior BI-analist bij DNB.
 Zo doe je dat als senior BI-analist bij DNB.
","De Nederlandsche Bank","Amsterdam","€3.940 - €5.600 per maand -  Voltijds","4.2","20"
"bc32f160c41b3fab","Reporting Analyst Commercie","Het team bestaat uit Business Analysts (2), Data Scientists (3) en presentatie- en data managers.
 Als Reporting Analyst land je (welkom aan boord!) in het…
","etos","Zaandam","€4.000 per maand -  Voltijds","3.7","89"
"67d7df078d5958af","Business Analyst Financial Crime Advisory and Investigations","Zo ben je als Business Analyst niet alleen betrokken bij onderzoeken naar vermeende fraude en corruptie, maar ook bij compliance en frauderisico preventie…
","Deloitte","Postcode 1081 in Amsterdam Zuid+2 plaatsen",NA,"4","10502"
"ef51cf6616d54607","Business Analyst - SaaS (Europe)","Knowing the product inside-out and never losing sight of delivering a great user experience;
 Creating spot-on user stories for the engineering team and leading…
","Castor","Tijdelijk thuiswerken","Voltijds",NA,NA
"0ad2f0a4d1c9b18d","Senior Business Analyst - Data & Analytics","Als senior business analyst sta je in de spits van onze projectorganisatie.
 Je hebt aantoonbare kennis van en ervaring met (big) data projecten;
","Incentro International BV","Postcode 3528 in Utrecht","Voltijds",NA,NA
"be7e78a7ea059014","Lead Data Engineer","You will identify & resolve technical, performance and data issues with the DWH together with our data analysts.
","Otrium","Amsterdam",NA,NA,NA
"85a11668c7375c45","Design: Business Analist","Kennis in meerdere gebieden zoals web en mobiele toepassingen, robotisering, blockchain, datawarehouses en-of data management.
","Daarom IT","Postcode 6825 in Arnhem",NA,NA,NA
"4aa613516f9583c4","Data Engineer","Samenwerken met de data scientists en data analysts aan het standaardiseren van data exchange processen;
 Minimaal 3 jaar aantoonbare ervaring als data engineer…
","De Immigratie- en Naturalisatiedienst","Den Haag","Contract bepaalde tijd",NA,NA
"9e358e87a5519392","nieuwData Analytics Techionista Academy","Finding trends in data sets and developing algorithms to help make raw data more useful to the enterprise.
 An interest in data and analytics.
","Avanade","Amsterdam",NA,"3.7","302"
"1c2b14bc539d5116","Senior accountmanager zorgverkoop Dimence Groep","Verder heb je veelvuldig afstemming met andere collega’s zowel binnen als buiten de dienst, zoals de data-analist, contractmanager, afdeling control en…
","Dimence Groep","Deventer","Deeltijds","4.1","11"
"6a20707e54874606","Business analist","Deze data komt uit een van de grootste data lakes van Nederland.
 Je gebruikt de data van zowel de online als offline klantinteracties, aangevuld met data van…
","DPG Media","Postcode 2132 in Hoofddorp","Voltijds","2.8","11"
"4000879fc234ab44","Data Engineer","Collaborate with data research analyst to conduct data analysis for company-specific and industry-wide research.
 Respond to requests for data and analysis.
","Apeiron Insight","Thuiswerken in Rijswijk","Vaste baan",NA,NA
"70c50667036b8f27","Investment Analyst, Diversified Loan Strategy","Previous work experience with quantitative analysis, loan-level data, and/or large data sets is a plus.
 Qualitative analysis on loan markets, direct lending…
","Dynamic Credit","Postcode 1076 in Amsterdam Zuid","Voltijds",NA,NA
"aed9b019296ce1f9","Consultant data analytics","Experience with at least one data analysis tool such as R or Matlab.
 The Data Analyst will be assigned to a variety of projects at our customers.
","IntroMediates","Huizen",NA,NA,NA
"058780ef8e25ee5d","nieuwSAP S/4 Business Analyst","Experience creating process maps and/or data flow diagrams is highly preferred with Igrafx.
 The Technology Lead, Business Analyst – ERP PL will liaise with…
","Johnson & Johnson Family of Companies","Nederland",NA,"4.2","6499"
"5b6221be17f38439","Senior Quantitative Data Analyst (Portfolio Management Retai...","You are an experienced quantitative data analyst, who is capable of applying these skills within Retail Banking of NIBC.
","NIBC","Den Haag","Voltijds",NA,NA
"c2bcd453f7dca0d6","Digital Phenotyping Data Analyst","Automatization of data processing pipelines.
 Phenotyping methods for improving the data collection.
 Processing of raw data into interpretable information.
","Solynta","Wageningen","Voltijds",NA,NA
"b5a50f65248f7e14","Business Analyst","Dit prioriteiten proces ondersteun je op basis van klantinzichten en data.
 Een probleem definiëren met data van verschillende bronnen kun jij als de beste.
","RTL Nederland","Hilversum","Voltijds",NA,NA
"9e03c4d1ed5a324e","nieuwFinancial & Reporting analyst","Strong analytical and data gathering skills.
 Reconcile transactions by comparing and correcting data.
 Analyze financial data and create financial models for…
","BRAC International Holdings B.V.","Den Haag","€4.000 per maand -  Voltijds",NA,NA
"46ef8f9b5a7d08e3","Data(Ops) Engineer","Automate the deployment and execution of data workflows such as ETL (data ingestion), data aggregation, data synchronization.
","Talpa Network","Hilversum","Voltijds",NA,NA
"096be47b50d34672","Engineering Manager","The Engineering Manager (EM) oversees the technical scope of a set of product teams (we call that a tribe) and they are responsible for delivering a quality…
","Relive","Thuiswerken","Voltijds",NA,NA
"08ff94886128bf44","Business Analyst & Change Management around the ‘Customer Ca...","High level of organizational skills, analytical capabilities and ability to structure data and content;
 It aims to further enable employees of Customer Service…
","IMCD","Nederland","Stage","4.4","12"
"b471e942ec4455d5","Manager Workforce Management Coolblue Stores","Analytisch. Je bent in staat om op basis van data verbeterpunten te bepalen.
 Samen zorg je ervoor dat de winkels elke dag een beetje beter worden door het…
","Coolblue","Thuiswerken in Rotterdam",NA,"3.9","213"
"156643125d43971a","Business Analyst (NL)","Create, conduct and coordinate financial, product, market, operational and related data research to support Sonion’s Portfolio Value Optimization, Strategy and…
","sonion","Nederland",NA,NA,NA
"ee2feb1446a1d3a7","Informatieanalist","Ervaring als analist bij één van de veiligheidspartners van de gemeente is een pre.
 Ondersteun je zowel bij het innemen en vaststellen van…
","Gemeente Utrecht","Utrecht","€3.017 - €4.562 per maand -  Contract bepaalde tijd","3.6","47"
"3ca0915b3e0f5ebc","Enterprise data architect","Increase self-service data capabilities.
 Increase the stability of our data landscape.
 Experience in designing, analyzing, and implementing highly-available and…
","DPG Media","Thuiswerken in Postcode 1018 in Amsterdam Centrum","Voltijds","2.8","11"
"f978375d051d1021","Business Analist","Van verzekeringen tot financieringen, van data tot online portalen.
 Als onderdeel van het DevOps team ben je op zoek naar hoe de meeste klantwaarde kan worden…
","Bovemij","Thuiswerken in Amsterdam","Voltijds","4","2"
"0f524de80b2bf3af","Strategisch Financieel Analist","Opleiding in of ervaring met data / financiële modellering;
 Ontwerpen en onderhouden van data modellen en financiële modellen;
","Zonel Energy","Delft","€4.340 - €7.058 per maand",NA,NA
"d0e26849b0dc1558","Operations Supervisor E-commerce (NL)","Have a knowledge of Incoterms , HS Codes, COO, accurate data is important in International shipping.
 Handle carrier exception reporting on a daily basis.
","Global-e","Thuiswerken",NA,NA,NA
"2de9a6cb9a70892b","nieuwData Analist Afval","Heeft affiniteit met techniek en data;
 Kan uitstekend omgaan met data-analyse tools, zoals bijvoorbeeld Power BI;
","Milgro B.V.","Postcode 3047 in Rotterdam","Voltijds, Vaste baan",NA,NA
"7e7ce7c75e4d1200","Vacature Business Intelligence Analist","Je helpt anderen de juiste weg te vinden in alle beschikbare data én je bent dagelijks bezig om de vertaling te maken tussen de data en operationele processen.
","Humaris","Postcode 3439 in Nieuwegein","Voltijds, Deeltijds",NA,NA
"18e89dca2d935aa6","WEB DATA ENGINEER (M/W/D)","Du wirst zu einem strategischen Partner für Führungskräfte von Canyon und arbeitest an Daten für verschiedene Abteilungen wie Marketing, Sales, Business…
","Canyon Bicycles","Eindhoven",NA,NA,NA
"c7eabc878ed2487d","Research Analist","Je houdt ervan om je vast te bijten in kwantitatieve data.
 Je ervan houdt om op verschillende manieren naar kwantitatieve data te kijken;
","Blauw Research","Rotterdam","€2.979 - €4.011 per maand -  Deeltijds",NA,NA
"fb5488ee63ec600e","Senior Consultant Data Science","Bij onze oplossingen staat data altijd centraal.
 Ben je de lead data scientist op een project: jij zet de lijnen uit en bedenkt de analyses voor het data…
","Capgemini","Utrecht","Vaste baan","3.8","8510"
"bb9f839e69a20d3a","Data Analyst - Accommodations","Experience in data management, data visualization and quality.
 Be familiar with the larger data ecosystem at Booking and how it relates to your data and the…
","Booking.Com","Amsterdam+3 plaatsen",NA,"3.7","911"
"1c3061c8ce65137f","Laboratorium Medewerker","Uiteindelijk kun je data in informatie vertalen.
 Je beschikt over een relevant MBO diploma zoals MLO analytische chemie of laboratorium techniek en enige…
","Royal Swinkels Family Brewers","Lieshout","€32.497 - €39.045 per jaar","4.9","7"
"d90c77b530fe123c","SCRUM MASTER / DATA ANALIST","Na verloop van tijd zal er ruimte ontstaan om ook andere, inhoudelijke taken op te pakken in de rol van data analist.
 32-36 UUR / UTRECHT / PER DIRECT.
","Bevolkingsonderzoek","Utrecht","Deeltijds","4.5","2"
"4fe3057fea1214d9","C# Senior Developer Data Hub","You will then write Scala code execute the resulting Mendix model.
 This means implementing the REST and OData protocols, making them available to the low-code…
","Mendix","Rotterdam","Voltijds","4.2","16"
"311e0b9b7a0de44b","Menu Analyst","Research competitors and data from other HelloFresh markets to compare with BNLX performance and build new business cases.
 Travel reimbursement to the office.
","HelloFresh","Hybrid remote in Amsterdam","Stage","3.1","829"
"56bb08d0f2c7779d","Data Business Informatie Analist","Je hebt zeker 5 jaar aantoonbare werkervaring op het gebied van “data”.
 Als Data Business Informatie Analist ben je onderdeel van de afdeling Innovation &…
","Makro Nederland","Amsterdam","Voltijds","4","3283"
"8dc858aa86d0d206","Data Engineer","Collaborate with domain experts, analysts, and backend engineers to solve data challenges.
 An understanding of data warehousing concepts and design patterns.
","FarmTrace","Boxmeer",NA,NA,NA
"03b3b900f0187838","Data Engineer/Analyst","Design and build data pipelines into a cloud data platform.
 Analyze video streaming domain-specific log data to devise transformations.
","Divitel","Apeldoorn","Voltijds","4.3","4"
"c5cb7369cbaaa720","Senior Data Analyst","Nice to have: experience with data modelling tools, such as dbt.
 Collaborate on the architectural evolution of the Tiqets data model and reporting framework.
","Tiqets","Thuiswerken in Amsterdam","Voltijds",NA,NA
"8002204c475235d3","Data Governance & Master Data Management","Implementing the data governance and/or master data management solution.
 Establishing and communicating a vision on data governance and/or master data…
","Valcon","Postcode 3541 in Utrecht",NA,NA,NA
"43f66f7126deeca2","Transformation consultant - Enterprise Transformation & Meth...","Jouw thuisbasis voor het ontwikkelen en inzetten van jouw vakkennis is het cluster Enterprise Transformation & Methods.
","Capgemini","Utrecht",NA,"3.8","8510"
"109c573b4dfc0dd2","Performance Marketing Specialist (Facebook & Instagram)","Able to translate data to content and vice versa.
 You work closely with other performance marketeers, analysts and creatives to achieve our ambitious growth…
","Picnic","Thuiswerken in Amsterdam+1 plaats",NA,"3.3","211"
"87442bf548feab6c","Product Owner Product Development","The team is fed with information from the testers, field installations, data analysts, manufacturing engineers, service technicians and the development program…
","Lely","Postcode 3147 in Maassluis+1 plaats","Voltijds","3.8","59"
"ea640c35ce3a6e6e","Junior Data Analist","Als data-analist houdt jij je bezig met verzamelen en analyseren van beschikbare data door middel van SQL.
 Beginnende kennis en ervaring met het verzamelen van…
","YER","Bunnik","Voltijds","4.3","66"
"a2bb3366e8d9945c","Informatie Analist","Kennis van data modellering en data logistiek;
 Overzie je processen en kun je deze vertalen naar oplossingen binnen (cloud) data platformen;
","OneDNA","Postcode 3527 in Utrecht",NA,NA,NA
"c4160003091b824d","Senior Research Consultant - FMCG","Soon you will evolve to guiding junior research consultants and/or data analysts responsible for data cleaning, analysis and first reporting.
","InSites Consulting","Thuiswerken in Rotterdam","€55.000 per jaar -  Voltijds, Vaste baan",NA,NA
"a83a765e99356cf5","Roadmap to Zero - Business Analyst","Conduct data analysis for the annual strategy impact report and support data visualisation projects.
 A minimum of 5 years of experience in business and data…
","ZDHC Foundation","Thuiswerken","Voltijds",NA,NA
"748dcf3e97887e76","IT RAR Applications Analyst – Senior","Proficient with related data structures and system configuration with a solid understanding of financial integration points to S4 modules including the General…
","Siemens","Thuiswerken in Nederland","Voltijds","4","10034"
"ccf653ec7339c469","Medior data analist","Als medior data analist doe je voornamelijk data-analyses en rapporteer je hierover.
 Als data analist onderzoek je in dit geval het effect van de…
","SIGNIFICANT APE","Postcode 3541 in Utrecht",NA,NA,NA
"c26ade9c58e4a496","Investment Analyst","(SAMCo) is the in-house asset manager of the Royal Dutch Shell plc group.
 With total assets under management of around USD 90bln, these funds make up one of the…
","Shell","Rijswijk","Voltijds","3.9","8646"
"b381de3db034f63a","Business Analist","Het continu optimaliseren van processen, applicaties en data vraagt veel van organisaties en teams.
 Je hebt ervaring met het identificeren, analyseren en…
","To The Point Company","Postcode 4103 in Culemborg","€3.500 - €5.500 per maand",NA,NA
"68a71c272dd50b17","Data Security Analyst","Transform data into insights, to identify and quantify opportunities to reduce instances of data leakage.
 You are able to craft and run queries to get relevant…
","Booking.Com","Amsterdam",NA,"3.7","911"
"1249a1e3a115aea6","Senior Paid Search Consultant","An interest in the broader scope of data tracking, conversion attribution, and other technical subjects is appreciated.
","Artefact","Utrecht","Voltijds",NA,NA
"31061ee6a9770b37","nieuwAnalytics Engineer - GoDataDriven","With your strong communication skills, you help uncover business needs and how to support that with data, reporting and visualization.
","Xebia Group","Postcode 1091 in Amsterdam Oost+1 plaats","Voltijds",NA,NA
"f888b79700a7e3e4","nieuwProduct Designer - Global Innovation Company","Collaborate with analysts to provide data-driven design recommendations.
 Transform data into actionable insights that highlight design opportunities.
","Frost Talent","Amsterdam","Voltijds",NA,NA
"7c564382729d0b02","Senior Data Analist","Als senior data analist weet je alles van data, data-analyse en modelleringstechnieken.
 Als (senior) data-analist weet je alles van data en data-analyse en doe…
","Cmotions Recruitment","Postcode 3981 in Bunnik+1 plaats","€4.197 - €5.558 per maand",NA,NA
"4fe8807106d6659f","Data Science and Infra Structure Analyst","Advise and support the Centers of Expertise-value streams on the analytical infrastructure (tools, processes, master data).
","Medtronic","Heerlen",NA,NA,NA
"2b9141e3bcc36787","nieuwData Analist","Als Data Analist ben jij de 'linking pin' tussen de business en de BI-afdeling.
 In deze dynamische rol komen alle aspecten van BI samen.
","Eiffel","Utrecht","€2.700 - €4.000 per maand -  Voltijds","2.8","4"
"4458dc147964e105","INVENTORY OPERATIONS ANALYST","Strong computer and data analytics skills.
 The Inventory Operations Analyst combines their strong data & analytics skills with business knowledge to forecast…
","Nike","Hilversum",NA,"4.1","10469"
"41c9d5745149ffa2","Data Quality Analyst","By collecting their data requirements and reverting back your findings, you are able to successfully improve the master data quality within DSM Food & Beverages…
","DSM","Delft",NA,"3.6","354"
"e7bddb64ee79fc5c","Business Intelligence Analyst","Work with Power BI to create data extracts, data flows, schedule gateway refreshes and setup corresponding security.
","Applied Medical","Postcode 3815 in Amersfoort",NA,"3.2","246"
"e0cb85ccd3c584e7","Business Analyst Online","Bent data gedreven en hebt hands-on ervaring met data-analyses;
 Word jij warm van digitale producten en proposities?
 Jij bent van alle markten thuis.
","Jumbo Supermarkten","Postcode 5462 in Veghel","€3.900 - €5.000 per maand","3.5","1576"
"596a07231ba59f1c","Technical Support Analyst","The EAM Technical Support Analyst provides support to customers, answering questions on technical and functional usage of product via the telephone and/or…
","Infor","Thuiswerken","Stage","3.7","553"
"e069ed2de1c96fd3","Lab Technician / Molecular Analyst (32-40 hours per week)","Preparing, executing and analyzing experiments to produce reliable data.
 As a service provider, GenomeScan provides innovative DNA and RNA analyses for patient…
","GenomeScan B.V.","Postcode 2333 in Leiden","Voltijds","4","2"
"4694488021dfded6","BUSINESS ANALIST CONTACT CENTER","Jij bent de ware schatgraver die met data en feiten helpt om onze dienstverlening nog persoonlijker te maken en onze klanten zich meer bijzonder te laten voelen…
","de Bijenkorf","Amsterdam",NA,"3.8","72"
