"job_id","job_title","job_snippet","company_name","company_location","job_salary","company_rating","company_no_reviews"
"eeb457199a29ae6d","nieuwBusiness Intelligence analist","De kracht van data wordt hierin steeds belangrijker.
 Het doel is om een zo goed mogelijke integratie van data te realiseren ter ondersteuning van analisten en…
","De Nederlandsche Bank","Amsterdam","€3.390 - €4.830 per maand -  Deeltijds","4.2","20"
"4faad63439b67c59","Data-analist","Door het bijzondere karakter van de WOZ-werkzaamheden gaat het in de meeste gevallen om zelf ontwikkelde analyses.
","Waarderingskamer","Postcode 2511 in Den Haag","€4.000 - €5.800 per maand",NA,NA
"742a4c0d8383e365","Data Analist Klantrapportages AIM","Je bent verantwoordelijk voor de volledigheid, traceerbaarheid en kwaliteit van data;
 Je hebt minimaal 2 jaar werkervaring in een omgeving met veel data.
","Achmea","Zeist","€3.520 - €4.898 per maand","3.8","200"
"6f28ff3f1c242425","nieuw(Jr.) Data Analist","Mail je CV en motivatie naar vacature@gamebasics.nl o.v.v. junior data analist.
 Het data en analytics team is verantwoordelijk voor het ontsluiten, analyseren…
","Gamebasics","Zoetermeer","€2.300 - €3.000 per maand",NA,NA
"4c88b1ea7fac43da","Data Analist","Planning- en organisatievaardigheden die je in staat stellen om van ruwe data naar concreet inzicht te komen.
 Denk hierbij aan commerciele toepassingen als CLV,…
","Louwman Group","Raamsdonksveer","€2.900 - €4.300 per maand -  Voltijds","3","6"
"90e7cb581ec2dd5a","Junior Data Analyst | Online chatting platforms","Technical expertise regarding data models, database design development, data mining and segmentation techniques.
 8% holiday pay on top of a generous salary.
","Dexter Staffing","Rotterdam","Voltijds, Vaste baan",NA,NA
"776b45723fc699db","Data Analist","Aan de hand van data genereer jij inzichten voor onze klanten, zodat zij met deze informatie hun bedrijfsprocessen kunnen verbeteren;
","Axians","Eindhoven",NA,"3.7","53"
"b51a1fa012210d6f","Senior Operations Engineer","Mastery understanding in data synthesis and processing from origination to completion.
 Mastered troubleshooting techniques and thinks creatively about solutions…
","Disney Media & Entertainment Distribution","Amsterdam","Voltijds",NA,NA
"f833f1642ebaec5f","nieuwEMEA Data Center Support Analyst","An ideal candidate for this role would have data center operation and/or maintenance experience.
 If you like technology, solving problems, working with a…
","Avicado Construction Technology Services","Thuiswerken in Eemshaven","Stage",NA,NA
"77a06c796ca12be7","nieuwData Analist / BI","Je organiseert inspiratiesessies, trainingen en workshops op het gebied van data gedreven werken en Smart Society om de technische vaardigheden en het data…
","RA'Quel","Utrecht","Deeltijds",NA,NA
"1caed14786dc4d33","Data Science Intern","Knowledge of SQL for data query.
 Has a 'storytelling' ability through data to translate results into actionable insights and/or interventions.
","Atradius","Amsterdam","Voltijds","4.1","28"
"62b7bc3ea047d89f","Requirements analist Data (BI / DWH)","Experience with data modelling, data architecture, data analysis, data quality checks and visualization of data in Power BI.
","Apollo IT","Thuiswerken",NA,NA,NA
"e21416fad1bdc5ce","nieuwMedewerker projectsupport en business data analist","Projectmanagers onderzoeken wat de mogelijkheden van big data zijn.
 Bij ons in Den Haag versterk jij als medewerker projectsupport/businessdata-analist in één…
","Rijksdienst voor Ondernemend Nederland (RVO)","Hybrid remote in Den Haag",NA,NA,NA
"605c641dfddad920","Data Management Consultant KYC","You work together with model developers and data engineering squad to get data quality requirements clear, set up data definitions and follow up on and resolve…
","Rabobank","Postcode 3521 in Utrecht","€3.714 - €6.323 per maand -  Voltijds","4","1343"
"9ff1b06c34e56863","Trainee Business Intelligence","Als trainee leer je de fijne kneepjes van het consultancy vak direct in de praktijk.
 Als trainee word je direct vanaf dag één gecoacht door een ervaren Salvéos…
","Salvéos","Oosterbeek","Voltijds, Stage",NA,NA
"4f51f5eb23cefd07","Data Analist | Belastingdienst | 32-36 UUR | 6 maanden | Ned...","Een uitgebreide gereedschap- en data set waardoor wij meer waarde realiseren in minder tijd.
 Relevante certificaten en meerdere jaren werkervaring op het gebied…
","Supply Value","Postcode 3708 in Zeist","Voltijds",NA,NA
"73847557e663d6e8","Data Engineer Junior","Develop and orchestrate multiple data pipelines.
 Build the infrastructure required for optimal extraction, transformation, and loading of data from a wide…
","Dashmote","Thuiswerken in Postcode 1012 in Amsterdam Centrum+2 plaatsen","Voltijds",NA,NA
"1eea542bc109aa65","Analist / Data search specialist","Hiermee zorg jij voor relevante inzichten uit de beschikbare data.
 Je bent analytisch en kunt data vertalen naar marktinzichten en rapportages.
","DBG Nederland","Nijverdal","Voltijds, Vaste baan, Tijdelijk",NA,NA
"7b5aee15919c82a0","Financieel-economisch analist betalingsbalans","Je analyseert onze data en processen om de kwaliteit van onze statistieken steeds verder te verhogen.
 Je draagt actief bij aan innovatie in systemen, processen…
","De Nederlandsche Bank","Hybrid remote in Amsterdam","€3.390 - €5.600 per maand -  Voltijds","4.2","20"
"0230ef568f1e53b0","Data Analyst","Proficiency with BigQuery and customer data platforms is a plus;
 You analyze traffic, sales data and consumer behavior to provide insights, such that:
","O'Neill","Warmond","Voltijds",NA,NA
"4c5949d06cdcec4a","Clinical PK/PD Data Analyst","Review and contribute to PK analysis plans and data transfer agreements.
 Enthusiastic about working with data and knowledge of SAS or another program language…
","hVIVO Services Limited","Thuiswerken in Postcode 4822 in Breda",NA,NA,NA
"232eb06ad41457b3","nieuwData analist Supply chain","Als data analist kom jij te werken binnen onze transportafdeling in Steenderen, waar je onderdeel uit maakt van een divers team.
","Aviko NL","Postcode 7221 in Steenderen","Voltijds",NA,NA
"4abce8ddead76c9b","Data Quality Analyst","MSc in IT, data management or data science with excellent academic results;
 Design and implementation of data quality checks on completeness, accuracy, validity…
","ING","Amsterdam+3 plaatsen",NA,"3.9","1923"
"05d885b5e004b1d9","Senior Data Scientist Operations Research","In deze rol maak je deel uit van een innovatief, multidisciplinair team van data scientists, software engineers en business analysten.
","Bol.com","Utrecht",NA,"3.9","47"
"f6b87059dcf1af75","Data-analist 32 uur","Als onze Data-analist ben je verantwoordelijk voor de analysefase.
 Bovenal haal je vanuit je data-analyses nieuwe kansen en denkrichtingen naar boven.
","BFG","Postcode 3861 in Nijkerk","Voltijds",NA,NA
"8aa3fa87d75d5609","Data Analyst","Our ideal candidate is adept at modeling complex data, uncovering patterns, and delivering data-driven insights.
","Lemonade","Amsterdam",NA,NA,NA
"315fc9d6080529ff","Regulatory reporting specialist / data-analist","Regulatory reporting specialist / data-analist to cart.
 Je kunt relevante data verzamelen, analyseren en gebruiken voor het opstellen van heldere rapportages.
","De Volksbank","Utrecht","€2.870 - €4.415 per maand -  Voltijds","4","24"
"7a0b831f4ef6edff","Data Analyst","You will work with data source systems and target systems to identify data issues and data gaps.
 Visualizing data using tools like Tableau.
","IDEXX","Postcode 2132 in Hoofddorp","Voltijds","3.4","567"
"a3b21336a126be18","Data Analyst – Platform P&L","You’re a data glutton.
 Yes, if you bring a master’s degree and 2-5 years of data analytical experience to the table: (financial) data is your home away from…
","Bol.com","Utrecht",NA,"3.9","47"
"b100340270eeb08e","nieuwData analyst audiences","Voor deze rol als data analyst audiences zoeken we iemand met 1+ jaar ervaring als data analist.
 Amsterdam - Als data analyst audiences maak je klant- en…
","DPG Media","Postcode 1018 in Amsterdam Centrum+6 plaatsen","Voltijds","2.8","11"
"38dff7dd9ff137f0","Laboratoriummedewerker / Analist Microbiologie","Aantonen en bevestigen van diverse bacterie stammen conform Standard Operating Procedures, gebaseerd op ISO 17025;
 Minimaal beschikt over een MLO-3 diploma;
","Merieux NutriSciences","Ede","Voltijds","2.7","267"
"2a69d120e88f8cc8","Data analist finance & risk center","Als junior data analist binnen het Finance & Risk domein kun je dit waarmaken.
 Je werkzaamheden bestaan uit het verzamelen en valideren van data uit…
","Rabobank","Postcode 3521 in Utrecht+2 plaatsen","Voltijds","4","1343"
"3ed498ea7b7d0388","Data Analyst","You work on tasks that include, but are not limited to data pipelines, data warehousing, building dashboards, predictive analysis, and algorithmic…
","Packaly","Thuiswerken in Amsterdam","Voltijds",NA,NA
"dbbe26bbdac78354","Senior Data Analist","Zelfstandige uitvoering van complexe data-analyse projecten op basis van interne en externe databronnen.
 Ervaring in data-preparatie, onderzoek en analyse en…
","The Sharing Group","Amsterdam","Voltijds",NA,NA
"48ea0ad1d24d4e63","Business Analyst","Front End Analytics: data visualisation, data storytelling and mobile app development.
 Business processes: data modelling and business analysis.
","Viqtor Davis","Nederland",NA,NA,NA
"6dd9ad948a721d7d","Data Analyst","Dit is het data platform waar de systemen van Transaction Processing worden ontsloten tot een centrale data set voor reporting.
 Ervaring met Power BI en DAX.
","CCV","Tijdelijk thuiswerken in Arnhem+1 plaats","Voltijds","3.6","24"
"d6e8a8126b5a49f2","Datamanager/Data-analist Nationale Intensive Care Evaluatie...","NICE verzamelt, beheert en bewerkt data over alle opnamen op Nederlandse Intensive Cares en heeft tevens een belangrijke rol in de informatievoorziening rond de…
","Amsterdam UMC","Amsterdam",NA,"3.7","32"
"ea5411b2f177ee7f","Business Intelligence Analist","Door data te vertalen naar (stuur)informatie, zorg jij ervoor dat de kwaliteit van processen inzichtelijk worden.
 Heb je ervaring met MS Office;
","paraDIGMA groep","Nieuwegein",NA,"5","7"
"1af0b64c56b4c2ad","medior/senior data analist","Data modellering (ERD’s ontwerpen).
 Een typische klant van i-spark is een bedrijf met een business model dat is gebaseerd op e-commerce, waar veel data aanwezig…
","I-spark","Groningen",NA,NA,NA
"48190138e7d896a1","DATA-ANALIST","Als data-analist lever je periodiek en ad-hoc rapportages van de verzamelde data.
 Wij van Zelfstandige Adviseurs zijn opzoek naar een data-analist.
","Zelfstandige Adviseurs","Schiphol","€2.500 - €3.500 per maand -  Voltijds",NA,NA
"159e4e25a6b983e2","Data analyst","Perform quality assurance and data cleaning of imported data.
 Collect data through market research, data mining, and collaboration with multiple stakeholders.
","Global KPO","Zaandam","Voltijds",NA,NA
"8426e4f60316b5f2","Data and Machine Learning Solutions Architect","The Data and Machine Learning Solutions Architect will provide technical leadership and mentorship for a team of engineers, data scientists, and analysts while…
","Baker McKenzie","America",NA,NA,NA
"09a87f795cf994cc","Informatie analist","€3344 - €5139 (schaal 11).
 Je bent een verbinder pur sang.
 Dat wil zeggen dat je naast het werken volgens een klassieke waterval methode ook zult deelnemen in…
","Rijkswaterstaat","Delft","€3.344 - €5.139 per maand -  Voltijds, Deeltijds, Contract bepaalde tijd","4","35"
"03c07c9317ac71ed","nieuwMedewerker Portefeuillebeheer / Data Analist","Als Medewerker Portefeuillebeheer / Data Analist kom je te werken bij Heinenoord Assuradeuren, een sterk groeiende financiële dienstverlener van circa 500 FTE.
","Fidus Groep","Heinenoord","€2.200 - €3.000 per maand -  Voltijds",NA,NA
"0320394f2e40f75f","Data Analist","Analyseren van ruwe data met o.a.
 Je bent bekend met data pipelines;
 Aantoonbare ervaring met het uitvoeren en presenteren van data-analyses;
","Visma Raet","Hybrid remote in Amersfoort","Voltijds",NA,NA
"2fac1a10fa1ea39f","nieuwBusiness Data Analyst BlueMovement","University degree > 5 years working experience as data analyst in dynamic environments.
 Ability to setup, maintain and analyze data sets with tools like Google…
","BSH Home Appliances Group","Hoofddorp","Voltijds","3.8","385"
"db7c99d9e9449ffd","Junior Financieel Analist","Financiële processen maak jij toekomstbestendig door gebruik te maken van de laatste ontwikkelingen.
 Jij hebt kennis opgedaan in het analyseren van grote…
","BrightStone Group","Thuiswerken in Amsterdam","€2.800 - €3.500 per maand -  Voltijds",NA,NA
"79aa96be114666be","Data Analist Digital","Je bent ervaren in het oplossen van business vraagstukken met data analytics en/of data science technieken d.m.v.
 Python / R. Dit is een must.
","albert-heijn","Zaandam","€4.000 per maand -  Voltijds","3.6","2902"
"48098eb19edc498c","nieuwData Analist Credit Management","Je ontwikkelt jezelf en collega's binnen jouw expertisegebied met o.a. collega data analisten en data scientists.
 Ruime ervaring met SQL (e.g. T-SQL, PL/SQL);
","Eneco","Thuiswerken in Rotterdam+2 plaatsen","€44.000 - €70.000 per jaar -  Voltijds","3.7","114"
"c9177316dc6ce93a","Data- & webanalist","Als data-analist help je onze organisatie meer inzichtgedreven te maken door relevante inzichten te leveren.
 Je zorgt voor rapportages en visualisaties van web-…
","Consumentenbond","Postcode 2521 in Den Haag","€3.220 - €5.294 per maand -  Voltijds","4.3","4"
"da3b8ef36dfaf872","Business analist","Je analyseert bedrijfsprocessen en informatiestromen binnen het domein van je resultaatteam.
 Je bent daarbij in staat om zelf processen op te tekenen en/of (te…
","SmartCenter","Randstad","Voltijds",NA,NA
"1e5df6f777021eb5","Analist genomics faciliteit","Je komt als analist te werken binnen de human Genomics faciliteit (Huge-F) van de afdeling Inwendige Geneeskunde.
","Erasmus MC","Rotterdam","Tijdelijk","4","62"
"869fe1b4149c6418","STAGIAIR(E) ONLINE MARKETING/ DATA ANALIST","Als online marketeer/data analist ben jij een cruciale schakel in social media marketing, online advertising, conversie-optimalisatie en het verbeteren van onze…
","Standby Thuiszorg","Postcode 5211 in Den Bosch","Stage",NA,NA
"9066c1663991b321","Data Scientist / Software Developer","Using data science, analytics and a variety of analytical, statistical or machine learning techniques to interpret client data, helping them to make better…
","Tessella","Den Haag",NA,NA,NA
"87f0e823e2c542b2","Junior Data Analyst","Importing (gathering), processing and reviewing project data.
 Liaise with internal and external stakeholders about project data and recommendations for…
","EVBox","Tijdelijk thuiswerken in Amsterdam","Stage","4","6"
"02f4fddf69ac5b99","Data Engineer","Projectmanagers onderzoeken wat de mogelijkheden van big data zijn.
 Iedere dag werken we aan maatschappelijke impact met behulp van data.
","Rijksdienst voor Ondernemend Nederland (RVO)","Hybrid remote in Utrecht","Vaste baan",NA,NA
"9bc1d8e3d53c8af5","Data Analist / Marketing Intelligence Analist","Jij bent als data analist gespecialiseerd in marketing intelligence.
 Team Data levert een belangrijke bijdrage aan het realiseren van onze (data)doelstellingen…
","De Hypotheker","Capelle aan den IJssel","Voltijds, Deeltijds","3.9","11"
"f2527700f88e9f7e","Marketing Data Analyst (Marketing Analytics)","Experience in applying data science tools to creating predictive analysis and insight.
 Identify and deploy control measures to ensure data quality, and lead the…
","SKIM","Rotterdam","Voltijds",NA,NA
"e64cd859f1124c53","Business Analist","De Business analist heeft een divers takenpakket op het gebied van bruggen slaan tussen de business en ICT.
 Een essentieel middel en onderdeel hiervan is ICT.
","Energie Data Services Nederland","Utrecht","Deeltijds","3.8","12"
"16ef1bcdbf42300a","Financieel Analist","Voor de data analyses werk je samen met het business intelligence team.
 Als financieel analist ga je dieper in op de business trends, bedrijfsmiddelen en…
","Bencom Group","Groningen","Voltijds",NA,NA
"0bed637ba11794f8","Linked Data Specialist","4 Uur per week Taxonic tijd voor eigen Research en Development.
 Veel Linked Data-projecten zijn in dit stadium nog korte klussen.
","Taxonic","De Meern","Deeltijds",NA,NA
"4b2cd3e8876aafa7","Master Data Analyst","You will support operations by processing, monitoring and analysing master data, key data, and master relationship data within the organization.
","Life Fitness","Nederland",NA,NA,NA
"22ad651831053af8","nieuwEnvironmental and Process Safety Data and Digital Analyst","Participate in data preparation for external audits.
 Experience working with large and complex data sets.
 Investigate options to harmonise and automate the data…
","Unilever","Rotterdam",NA,"4.2","7545"
"d5c5f0c2359391eb","Data Analist","Het analyseren van data en het stellen van probleemgerichte vragen voor het inwinnen van informatie en het oplossen van data problemen.
","INNAX GEBOUW & OMGEVING","Veenendaal","Deeltijds","4.9","7"
"a89ff929f52333b5","Adviseur bouw- en/of installatiekosten / data-analist","IGG Bouweconomie zoekt bouwkosten- en installatiekosten adviseurs.
 Als bouwkosten- of installatiekosten adviseur ben je medeverantwoordelijk voor het maken en…
","IGG bouweconomie","Doetinchem",NA,NA,NA
"00d93b399dc3de42","Data Scientist","Integrate data sets; Develop or program databases and query them to retrieve data to perform statistical analysis and to create reference class cohorts of data…
","Fluor Corporation","Hoofddorp","Stage","4.1","5036"
"af716dd8a4fe2e3f","nieuwBusiness Intelligence Analist","Je hebt een passie voor data en Business Intelligence.
 Voornamelijk houd jij je bezig met analyseren van data.
 Ervaring met PowerBI en DAX is een pré;
","Prevermo","Nijmegen","Voltijds","5","7"
"aeee9614786e2982","Data analist redactie","Als data analist ben je het data geweten op de redactievloer.
 Sparren en ontwikkelen op het gebied van data analytics kun je met het data analytics team.
","Financieel Dagblad","Hybrid remote in Amsterdam","€4.000 - €4.400 per maand",NA,NA
"cd44caa368297c12","nieuwData Analist Pon Equipment","Je gaat deze disciplines helpen inzicht te geven in verbetermogelijkheden op basis van data.
 Als Data analist zal je actief zijn in verschillende disciplines:…
","Pon Equipment B.V.","Almere+1 plaats","Voltijds","3.6","30"
"0355ec89b9d65f4e","Finance and Risk Data Analyst","You have an eye for structurally solving data quality issues.
 You are surrounded by energized and inspired colleagues and together you will tackle various…
","Rabobank","Postcode 3521 in Utrecht","Voltijds","4","1343"
"26989988da41811c","Data Analyst","Expert SQL and data modelling skills.
 Knowledge of database architecture, PostgreSQL, ETL/data preparation tools, APIs, data science and machine learning…
","Floryn B.V.","Thuiswerken in Postcode 5211 in Den Bosch","Voltijds",NA,NA
"5a696ff7b50f96f6","Clinical PK/PD Data Analyst","Review and contribute to PK analysis plans and data transfer agreements.
 Enthusiastic about working with data and knowledge of SAS or another program language…
","Venn Life Sciences","Thuiswerken in Postcode 4822 in Breda",NA,NA,NA
"be2fcede167fdb75","Proces & Data Analist","Vervaardigen van data-analyses en datamodellen.
 Ervaren MS SQL (T-SQL) en bekend met het maken van data marts.
 Het verzamelen en ordenen van gegevens.
","WilroffReitsma","Postcode 1165 in Halfweg",NA,"4.5","2"
"1cd6c968d9c1ecb4","Analist analytische chemie/ microbiologie","Je bent verantwoordelijk voor het volledige traject van monstervoorbereiding, uitvoeren van de het verrichten van de analyses, data interpretatie en het…
","Hoogheemraadschap Hollands Noorderkwartier","Edam","€46.680 per jaar -  Voltijds","4","5"
"dddea49c1772e13b","Data Analyst","Identificeren van procesverbeteringen op basis van data-analyse;
 Geef het management inzicht in prestatie-indicatoren.
 Je bent 40 uur per week beschikbaar;
","Eneco eMobility","Hybrid remote in Rotterdam","Voltijds",NA,NA
"6f2b6d7c5c39a7d9","Junior AML Analist","Hierbij mag je fouten maken zolang je er maar van leert.
 Je bent niet alleen een kritisch onderzoeker, je bent ook een kei in communiceren.
","BrightStone Group","Thuiswerken in Amsterdam+5 plaatsen","€2.800 - €3.400 per maand -  Voltijds",NA,NA
"7491be1d052ed323","Business/Data Analist","Een afwisselende rol bij een bedrijf met een scherpe visie op data.
 Als business analist bij DataTrust fungeer jij als specialist bij onze klanten, de…
","Hot ITem","Amsterdam+1 plaats",NA,"4.3","3"
"be47680b18dc6d4f","Internship Data verification, Clinical Outcomes","However, in order to obtain valuable insights, data quality must be high.
 You have experience with analysing large datasets and are interested in learning to…
","LOGEX","Thuiswerken in Postcode 7411 in Deventer","Stage",NA,NA
"0e5d40a1ea0ac6b3","nieuwWeb Analist","Als web analist vertaal jij online data naar overzichtelijke analyses en bruikbare inzichten.
 Als web analist participeer je tevens in diverse overleggen …
","Gemeente Amsterdam","Hybrid remote in Amsterdam+1 plaats","€4.671 per maand -  Vaste baan, Contract bepaalde tijd","4.1","162"
"c25b7074bb6feae0","Data Engineers*","Work together with data architects, business analysts and data scientists who are all passionate and excel in their domain.
","Dept","Thuiswerken in Amsterdam",NA,"4.6","26"
"b1cd6f0b2c5e9043","Data Scientist (NL)","Working with a data analyst, you collect, analyze and help to understand data;
 You have a basic knowledge of data science principles.
","Crunch Analytics","Postcode 3011 in Rotterdam","Voltijds",NA,NA
"f5704407d04debf3","nieuwINFORMATIE ANALIST (landelijk)","Je bent in staat data op een eenvoudige wijze te visualiseren.
 Je bent in staat om ingewikkelde informatieconcepten te interpreteren en te vertalen naar…
","QUALIFIED4U ICT GROUP B.V.","Amsterdam+1 plaats","Voltijds, Vaste baan",NA,NA
"f6f7f4de03e43596","Junior Quantitative Data Analyst Portfolio Management Retail...","Having just finished your quantitative study, as a new team member you will already play an important role in the various activities, with in particular an…
","NIBC","Den Haag","Voltijds",NA,NA
"e66f26236358f49e","nieuwSenior Data Engineer","Experience with coordinating with data analysts / business analysts to help operationalize KPIs and Metrics.
 Currently the analysts dive into a lot of raw data…
","Mendix","Rotterdam","Voltijds","4.2","16"
"24c77680af05e091","Senior Data Analyst","Develop data documentation (glossary, data models, etc.) to cover dedicated domains within the company.
 Rolling out the‘ data-as-a-service’ approach for Product…
","Dan.com","Postcode 1054 in Amsterdam West","Voltijds",NA,NA
"fa74285c4759805c","Airport GIS data analyst","As an Airport GIS data analyst, you will be part of the airport design team where you participate in masterplan and civil design projects on Airports.
","Royal HaskoningDHV","Thuiswerken in Den Haag",NA,"4","75"
"cc4856f722cd6cc6","Business Analist","Opzetten en verbeteren van data bronnen ten behoeve van betrouwbare (BI) analyses;
 Je helpt collega’s de juiste weg te vinden in alle beschikbare data, door dit…
","Mobacc","Nederland",NA,"3.6","5"
"5959da490d78ec26","Junior Data Analyst Partner Analytics","Je vertaalt data naar werkbare inzichten en adviezen en brengt die helder over op collega’s die (nog) wat minder data-savvy zijn.
","Bol.com","Utrecht",NA,"3.9","47"
"ccbdd8b46e1f9e89","Data Manager","Florensis digitaliseert en heeft daarmee steeds meer systemen waarin data opgeslagen en gegenereerd wordt.
 Hierbij gaat het zowel om masterdata (bijvoorbeeld…
","Florensis","Thuiswerken in Postcode 3342 in Hendrik-Ido-Ambacht","Voltijds, Vaste baan",NA,NA
"87fd751f4c74a08d","Data Analist","Je haalt voldoening uit het ontwikkelen van data modellen.
 Je vertaalt data naar informatie door middel van het ETL-proces (Extractie, Transformatie, Loading).
","Crowe Foederer","Eindhoven","Voltijds","3.6","145"
"77f7e6eaee28b3a8","Data Analist - Python","Voer data-analyse uit en vertaal deze naar audit proof documentatie die gebruikt kan worden voor besluitvorming.
","IT-idiots","Postcode 3511 in Utrecht+1 plaats",NA,NA,NA
"e93fe0243b6bcdbb","Credit Risk Data Analyst","You’ll develop the principles for creating data sets that meet the latest internal and regulatory requirements for data quality;
 A thorough mastery of SQL;
","Rabobank","Postcode 3511 in Utrecht","€45,23 - €77,00 per uur -  Voltijds","4","1343"
"dce6a157169d1c2c","Data Quality Specialist","Minimaal 3 jaar ervaring met data quality, data governance en metadatamanagement.
 Met jou als Data Quality Specialist binnen het Data Quality Center of…
","VodafoneZiggo","Utrecht","€3.401 - €4.859 per maand","4","2632"
"d39f3ba09fdece88","Data analist controlepraktijk","Minimaal 5 jaar ervaring in een functie als data analist of soortgelijk.
 Je houdt je daarnaast bezig met data-extractie en het uniformeren van data analyses.
","Vermetten | accountants en adviseurs","Postcode 5126 in Gilze","Voltijds",NA,NA
"51f59908eaf07bca","Business Analist","Als business analist ben jij de aanjager van datagedreven verbeteren binnen onze afdeling Customer Care.
 Het analyseren van interessante trends in de data en…
","Eneco","Thuiswerken in Rotterdam+3 plaatsen","€44.000 - €62.000 per jaar -  Voltijds","3.7","114"
"5ca6064e2aa6ddaf","Moleculair Biologisch Analist","Binnen deze functie ben je medeverantwoordelijk voor de ontwikkeling en analyse van nieuwe (op moleculaire biologie gebaseerde) ziektetesten op zaden.
","Rijk Zwaan","De Lier+1 plaats","Voltijds","4.5","22"
